{
  "taskArn": "arn:aws:ecs:us-east-1:123456789012:task/my-fargate-cluster/abc123",
  "clusterArn": "arn:aws:ecs:us-east-1:123456789012:cluster/my-fargate-cluster",
  "taskDefinitionArn": "arn:aws:ecs:us-east-1:123456789012:task-definition/my-fargate-task:1",
  "lastStatus": "RUNNING",
  "desiredStatus": "RUNNING",
  "launchType": "FARGATE",
  "cpu": "256",
  "memory": "512",
  "createdAt": "2026-04-19T12:00:00Z",
  "startedAt": "2026-04-19T12:00:30Z",
  "stoppedAt": "2026-04-19T12:00:00Z",
  "stoppedReason": "example-value",
  "networkInterfaces": [
    {}
  ],
  "tags": [
    "example-value"
  ]
}